{
  "$schema": "http://json-schema.org/draft-07/schema#",
  "title": "Professional Portfolio Schema",
  "description": "Schema for the user's professional portfolio data.",
  "type": "object",
  "properties": {
    "contact_info": {
      "type": "object",
      "properties": {
        "name": { "type": "string" },
        "title": { "type": "string" },
        "location": { "type": "string" },
        "phone": { "type": "string" },
        "email": { "type": "string", "format": "email" },
        "linkedin": { "type": "string" },
        "github": { "type": "string" }
      },
      "required": ["name", "title", "email"]
    },
    "professional_summary": {
      "type": "string"
    },
    "skills": {
      "type": "object",
      "patternProperties": {
        "^[a-zA-Z_]+$": {
          "type": "array",
          "items": { "type": "string" }
        }
      },
      "additionalProperties": false
    },
    "professional_experience": {
      "type": "array",
      "items": {
        "type": "object",
        "properties": {
          "role": { "type": "string" },
          "company": { "type": "string" },
          "location": { "type": "string" },
          "dates": { "type": "string" },
          "key_achievements": {
            "type": "array",
            "items": { "type": "string" }
          }
        },
        "required": ["role", "company", "dates"]
      }
    },
    "education": {
      "type": "array",
      "items": {
        "type": "object",
        "properties": {
          "degree": { "type": "string" },
          "institution": { "type": "string" },
          "year": { "type": "string" }
        },
        "required": ["degree", "institution", "year"]
      }
    },
    "certifications": {
      "type": "array",
      "items": { "type": "string" }
    }
  },
  "required": [
    "contact_info",
    "professional_summary",
    "skills",
    "professional_experience",
    "education"
  ]
}
